{
  "id": "dk-aarhus",
  "destination": "dk",
  "name": "Aarhus",
  "kind": "city",
  "coordinates": {
    "lat": 56.1629,
    "lon": 10.2039
  },
  "coordinatePrecision": "city",
  "character": "Denmark's second city and the one most shaped by its students. Smaller and cheaper than Copenhagen, with a compact centre and a real coastline.",
  "meta": {
    "schemaVersion": "1.0",
    "dataAsOf": "2026-09-22"
  }
}
