{
  "id": "dk-odense",
  "destination": "dk",
  "name": "Odense",
  "kind": "city",
  "coordinates": {
    "lat": 55.4038,
    "lon": 10.4024
  },
  "coordinatePrecision": "city",
  "character": "Funen's main city, midway between Copenhagen and Jutland. Mid-sized, flat, and much less expensive than the capital.",
  "meta": {
    "schemaVersion": "1.0",
    "dataAsOf": "2026-09-22"
  }
}
