{
  "id": "fr-paris-escp",
  "destination": "fr",
  "name": "Paris",
  "kind": "campus",
  "coordinates": {
    "lat": 48.8644,
    "lon": 2.3808
  },
  "coordinatePrecision": "institution",
  "meta": {
    "schemaVersion": "1.0",
    "dataAsOf": "2026-09-23",
    "notes": [
      "Also taught at Berlin, London, Madrid and Turin. This pin is Paris; it is not the only place ESCP teaches."
    ]
  }
}
