{
  "id": "dk-frederiksberg",
  "destination": "dk",
  "name": "Frederiksberg",
  "kind": "city",
  "coordinates": {
    "lat": 55.6786,
    "lon": 12.5312
  },
  "coordinatePrecision": "city",
  "character": "Its own municipality, surrounded by Copenhagen. Greener and quieter than the centre, and only a few minutes from it.",
  "meta": {
    "schemaVersion": "1.0",
    "dataAsOf": "2026-09-22"
  }
}
