{
  "id": "gr-mytilene-lesvos-across-six-islands",
  "destination": "gr",
  "name": "Mytilene (Lesvos), across six islands",
  "kind": "campus",
  "coordinates": {
    "lat": 39.0851,
    "lon": 26.5668
  },
  "coordinatePrecision": "institution",
  "meta": {
    "schemaVersion": "1.0",
    "dataAsOf": "2026-09-22"
  }
}
