{
  "id": "dk-viborg",
  "destination": "dk",
  "name": "Viborg",
  "kind": "city",
  "coordinates": {
    "lat": 56.4532,
    "lon": 9.402
  },
  "coordinatePrecision": "city",
  "character": "A historic cathedral town in the middle of Jutland, and a UNESCO Creative City of Media Arts because of its animation and visual-media cluster around The Animation Workshop. Small and quiet, with a housing guarantee for incoming students.",
  "meta": {
    "schemaVersion": "1.0",
    "dataAsOf": "2026-09-24"
  }
}
