{
  "id": "gr-mytilene",
  "destination": "gr",
  "name": "Mytilene",
  "kind": "campus",
  "coordinates": {
    "lat": 39.0851,
    "lon": 26.5668
  },
  "coordinatePrecision": "institution",
  "meta": {
    "schemaVersion": "1.0",
    "dataAsOf": "2026-09-22",
    "notes": [
      "The University of the Aegean is spread across six islands. This pin is Mytilene on Lesvos, where the university is headquartered; it is not the only place it teaches."
    ]
  }
}
